{
  "case_id": "EXPC-004",
  "experiment_id": "EXP-C",
  "version": "1.0",
  "risk": "HIGH",
  "artifact_ref": "inline:bid_closure_validation",
  "authoritative_intent_ref": "inline:bid_closure_contract",
  "invariant_refs": ["INV-BID-CLOSED-001"],
  "model_visible": {
    "contract": "No bid may be accepted after the listing closure timestamp.",
    "implementation_evidence": "accept_bid checks listing.status == 'OPEN' but does not compare current time to closes_at. A scheduled worker normally closes expired listings, but it may run late.",
    "test": "At closes_at + 2 seconds, listing.status remains OPEN and accept_bid returns success.",
    "failure": "Observed acceptance after authoritative closure time.",
    "task": "Diagnose the failure and state which artifact class, if any, is authorized to change."
  },
  "ground_truth_ref": "local-hidden:EXP-C-004.ground-truth.json",
  "tags": ["code-defect", "corrective-authority", "time-boundary", "bidding"]
}
