{
  "case_id": "EXPC-005",
  "experiment_id": "EXP-C",
  "version": "1.0",
  "risk": "MEDIUM",
  "artifact_ref": "inline:ci_test_runner",
  "authoritative_intent_ref": "inline:ci_contract",
  "invariant_refs": [],
  "model_visible": {
    "contract": "The scorer regression suite must execute in CI on Python 3.12.",
    "implementation_evidence": "The scorer compiles locally and the regression file imports only standard-library unittest plus the scorer module.",
    "workflow": "CI invokes python -m pytest -q without installing pytest.",
    "failure": "/opt/hostedtoolcache/Python/3.12/bin/python: No module named pytest",
    "task": "Diagnose the failure and state which artifact class, if any, is authorized to change."
  },
  "ground_truth_ref": "local-hidden:EXP-C-005.ground-truth.json",
  "tags": ["environment-tooling-defect", "corrective-authority", "ci"]
}
